websites,vendor,product_category,product_type,collection,design_name,design_sku,variant_name,variant_type,sku,description,keywords,images,install_images,price,sale_unit,sale_quantity,minimum_quantity,style,color,substrate,backing,roll_width_inches,roll_length_yards,mural_width_inches,mural_height_inches,tile_width_inches,tile_height_inches,motif_width_inches,vertical_repeat_inches,repeat_match_type,printed_width_inches,weight,application,removability,washability,color_fastness,fire_rating,print_type,margin_trim,print_to_order
H,Panoramic Images,Digital,Murals,National Parks,Joshua Tree National Park,100000,Joshua Tree National Park,Master,100000,Scaled to fit your wall. Some cropping may occur.,"Photography, Horizontal, Wispy White Clouds, Usa, Arid, Beauty In Nature, Boulder, Cactus, California, Cloud, Countryside, Day, Desert, Environment, Geology, Growing, Hill, Joshua Tree, Joshua Tree National Park, Landscape, National Park, Nature, Nobody, Outdoors, Persistence, Remote, Rock Formation, Rural Scene, Scenic View, Shadow, Travel, Travel Destinations, Tree, United States, Wilderness",https://s3-us-west-2.amazonaws.com/astek-product-images/National_Parks/100000_Joshua_Tree_National_Park_JOSHUATREENATIONALPARK.jpg,,6.5,Square Foot,1,1,Photographic,Multi,Paper,,,,,,,,,,Mural,,0.1,,Strippable,Washable,,Class A,Digital Print,Untrimmed,Yes
H,Panoramic Images,Digital,Murals,National Parks,"Mount McKinley, Denali National Park",109858,"Mount McKinley, Denali National Park",Master,109858,Scaled to fit your wall. Some cropping may occur.,"Photography, Horizontal, panoramic, panorama, Alaska, Alaska Range, beauty in nature, blooming, calm, cloud, color image, countryside, day, Denali National Park, environment, Epilobium latifolium, field, fireweed, flower, high angle view, lake, landscape, majestic, Mount McKinley, mountain, Mt McKinley, Mt. McKinley, National Park, nature, nobody, outdoors, peace, picturesque, remote, rugged, rural scene, scenic view, snowcapped, spring, summer, sunny, tranquil scene, united states",https://s3-us-west-2.amazonaws.com/astek-product-images/National_Parks/109858_Mount_McKinley_Denali_National_Park_MOUNTMCKINLEYDENALINATIONALPARK.jpg,,6.5,Square Foot,1,1,Photographic,"Green, Multi",Paper,,,,,,,,,,Mural,,0.1,,Strippable,Washable,,Class A,Digital Print,Untrimmed,Yes
H,Panoramic Images,Digital,Murals,National Parks,Muir Woods National Monument,111782,Muir Woods National Monument,Master,111782,Scaled to fit your wall. Some cropping may occur.,"Photography, Horizontal, panoramic, panorama, California, Famous Place, Forest, Marin County, Muir Woods National Monument, National Monument, National Park, Nature, Non-Urban Scene, Scenics, Sequoia, Sequoia Sempervirens, Tall, Travel Destinations, Tree, USA, Woods, Color Image, Day, Directly Below, No People, Outdoors, Redwood, North America",https://s3-us-west-2.amazonaws.com/astek-product-images/National_Parks/111782_Muir_Woods_National_Monument_MUIRWOODSNATIONALMONUMENT.jpg,,6.5,Square Foot,1,1,Photographic,Green,Paper,,,,,,,,,,Mural,,0.1,,Strippable,Washable,,Class A,Digital Print,Untrimmed,Yes
H,Panoramic Images,Digital,Murals,National Parks,"Grand Prismatic Spring, Yellowstone National Park",116860,"Grand Prismatic Spring, Yellowstone National Park",Master,116860,Scaled to fit your wall. Some cropping may occur.,"Photography, Horizontal, panoramic, panorama, Famous Place, Geology, Geyser, Grand Prismatic Spring, Heat, Hot Spring, Midway Geyser Basin, National Landmark, National Park, Natural Landmark, Natural Phenomenon, Nature, Physical Geography, Scenics, Travel Destinations, USA, Wyoming, Yellowstone National Park, Aerial View, Beauty In Nature, Color Image, Day, Geographical Locations, No People, Non-Urban Scene, Outdoors, Series, Hot, Psychedelic, Eye",https://s3-us-west-2.amazonaws.com/astek-product-images/National_Parks/116860_Grand_Prismatic_Spring_Yellowstone_National_Park_GRANDPRISMATICSPRINGYELLOWSTONENATIONALPARK.jpg,,6.5,Square Foot,1,1,Photographic,Multi,Paper,,,,,,,,,,Mural,,0.1,,Strippable,Washable,,Class A,Digital Print,Untrimmed,Yes
H,Panoramic Images,Digital,Murals,National Parks,"Geothermal Energy, Yellowstone National Park",118792,"Geothermal Energy, Yellowstone National Park",Master,118792,Scaled to fit your wall. Some cropping may occur.,"Photography, Horizontal, panoramic, panorama, Backgrounds, Color Image, Day, Energy, Full Frame, Geology, Geyser, Green, Hot Spring, National Park, Natural Landmark, Natural Pattern, Natural Phenomenon, Nature, No People, Outdoors, Rock, Rock Formation, Scenics, Travel Destinations, USA, Wyoming, Yellowstone National Park, Geothermal, Physical Geography",https://s3-us-west-2.amazonaws.com/astek-product-images/National_Parks/118792_Geothermal_Energy_Yellowstone_National_Park_GEOTHERMALENERGYYELLOWSTONENATIONALPARK.jpg,,6.5,Square Foot,1,1,Photographic,"Green, Multi",Paper,,,,,,,,,,Mural,,0.1,,Strippable,Washable,,Class A,Digital Print,Untrimmed,Yes
H,Panoramic Images,Digital,Murals,National Parks,"Reflection Lake, Mt Rainier National Park",119053,"Reflection Lake, Mt Rainier National Park",Master,119053,Scaled to fit your wall. Some cropping may occur.,"Photography, Horizontal, Beauty In Nature, Color Image, Day, Flower, Forest, Idyllic, Lake, Morning, Mountain, Mountain Peak, Mt Rainier, Mt Rainier National Park, National Park, Natural Landmark, Nature, No People, Non-Urban Scene, Outdoors, Panoramic, Peacefulness, Physical Geography, Pierce County, Plant, Reflection, Reflection Lake, Remote, Scenics, Sky, Snow, Snowcapped, The Natural World, Travel Destinations, Tree, USA, Washington State, Water, Wildflower, Serenity, Tranquility, Tranquil Scene, Calm, Peaceful",https://s3-us-west-2.amazonaws.com/astek-product-images/National_Parks/119053_Reflection_Lake_Mt_Rainier_National_Park_REFLECTIONLAKEMTRAINIERNATIONALPARK.jpg,,6.5,Square Foot,1,1,Photographic,Multi,Paper,,,,,,,,,,Mural,,0.1,,Strippable,Washable,,Class A,Digital Print,Untrimmed,Yes
H,Panoramic Images,Digital,Murals,National Parks,Joshua Tree National Monument,120863,Joshua Tree National Monument,Master,120863,Scaled to fit your wall. Some cropping may occur.,"Photography, Horizontal, panoramic, panorama, Beauty In Nature, Blooming, California, Cloud, Color Image, Day, Distant, Famous Place, Fragility, Growth, Horizon, Joshua Tree National Monument, National Monument, Landscape, National Landmark, No People, Non-Urban Scene, Outdoors, San Bernardino County, Scenics, Sky, Spring, Tranquil Scene, Travel Destinations, Twenty Nine Palms, Uncultivated, USA, Wildflower, Yellow",https://s3-us-west-2.amazonaws.com/astek-product-images/National_Parks/120863_Joshua_Tree_National_Monument_JOSHUATREENATIONALMONUMENT.jpg,,6.5,Square Foot,1,1,Photographic,"Yellow, Multi",Paper,,,,,,,,,,Mural,,0.1,,Strippable,Washable,,Class A,Digital Print,Untrimmed,Yes
H,Panoramic Images,Digital,Murals,National Parks,Forest in Redwood National Park,121482,Forest in Redwood National Park,Master,121482,Scaled to fit your wall. Some cropping may occur.,"Photography, Horizontal, panoramic, panorama, California, Color Image, Day, Del Norte County, Famous Place, Forest, Green, National Landmark, Nature, No People, Non-Urban Scene, Outdoors, Redwood, Redwood National Park, National Park, Scenics, Tranquil Scene, Travel Destinations, Tree Trunk, USA",https://s3-us-west-2.amazonaws.com/astek-product-images/National_Parks/121482_Forest_in_Redwood_National_Park_FORESTINREDWOODNATIONALPARK.jpg,,6.5,Square Foot,1,1,Photographic,Green,Paper,,,,,,,,,,Mural,,0.1,,Strippable,Washable,,Class A,Digital Print,Untrimmed,Yes
H,Panoramic Images,Digital,Murals,National Parks,"Oxbow Bend, Snake River, Grand Teton National Park",121681,"Oxbow Bend, Snake River, Grand Teton National Park",Master,121681,Scaled to fit your wall. Some cropping may occur.,"Photography, Horizontal, panoramic, panorama, Beauty In Nature, Clear Sky, Color Image, Covering, Day, Forest, Generic Location, Grand Teton National Park, National Park, Idyllic, Majestic, Mountain Range, Nature, No People, Non-Urban Scene, Outdoors, Oxbow Bend, Physical Geography, Reflection, River, Scenics, Snake River, Snow, Symmetry, Tranquil Scene, Travel Destinations, Tree, USA, Water Surface, Wyoming",https://s3-us-west-2.amazonaws.com/astek-product-images/National_Parks/121681_Oxbow_Bend_Snake_River_Grand_Teton_National_Park_OXBOWBENDSNAKERIVERGRANDTETONNATIONALPARK.jpg,,6.5,Square Foot,1,1,Photographic,Multi,Paper,,,,,,,,,,Mural,,0.1,,Strippable,Washable,,Class A,Digital Print,Untrimmed,Yes
H,Panoramic Images,Digital,Murals,National Parks,Silhouette of Saguaro National Park,127389,Silhouette of Saguaro National Park,Master,127389,Scaled to fit your wall. Some cropping may occur.,"Photography, Horizontal, panoramic, panorama, Arizona, Beauty In Nature, Carnegiea Gigantea, Cloud, Color Image, Desert, Landscape, Majestic, National Park, No People, Non-Urban Scene, Outdoors, Pima County, Saguaro Cactus, Saguaro National Park, Silhouette, Sky, Sunset, Tranquil Scene, Travel Destinations, Tucson, Uncultivated, USA",https://s3-us-west-2.amazonaws.com/astek-product-images/National_Parks/127389_Silhouette_of_Saguaro_National_Park_SILHOUETTEOFSAGUARONATIONALPARK.jpg,,6.5,Square Foot,1,1,Photographic,Multi,Paper,,,,,,,,,,Mural,,0.1,,Strippable,Washable,,Class A,Digital Print,Untrimmed,Yes
H,Panoramic Images,Digital,Murals,National Parks,"Saguaro Cactus, Saguaro National Park",127391,"Saguaro Cactus, Saguaro National Park",Master,127391,Scaled to fit your wall. Some cropping may occur.,"Photography, Horizontal, panoramic, panorama, Arizona, Beauty In Nature, Carnegiea Gigantea, Clear Sky, Color Image, Desert, Landscape, Majestic, National Park, No People, Non-Urban Scene, Outdoors, Pima County, Saguaro Cactus, Saguaro National Park, Silhouette, Sunset, Tranquil Scene, Travel Destinations, Tucson, Uncultivated, USA",https://s3-us-west-2.amazonaws.com/astek-product-images/National_Parks/127391_Saguaro_Cactus_Saguaro_National_Park_SAGUAROCACTUSSAGUARONATIONALPARK.jpg,,6.5,Square Foot,1,1,Photographic,"Pink, Purple, Multi",Paper,,,,,,,,,,Mural,,0.1,,Strippable,Washable,,Class A,Digital Print,Untrimmed,Yes
H,Panoramic Images,Digital,Murals,National Parks,Olympic National Park,130802,Olympic National Park,Master,130802,Scaled to fit your wall. Some cropping may occur.,"Photography, Horizontal, panoramic, panorama, Beauty In Nature, Color Image, Day, Flowing Water, Moss, Motion, Natural Landmark, No People, North America, Olympic National Park, Outdoors, Rainforest, Rock Formation, Scenics, Speed, USA, Washington State, Waterfall, White Water, Cascade",https://s3-us-west-2.amazonaws.com/astek-product-images/National_Parks/130802_Olympic_National_Park_OLYMPICNATIONALPARK.jpg,,6.5,Square Foot,1,1,Photographic,"Green, Multi",Paper,,,,,,,,,,Mural,,0.1,,Strippable,Washable,,Class A,Digital Print,Untrimmed,Yes
H,Panoramic Images,Digital,Murals,National Parks,"Delicate Arch, Arches National Park",130881,"Delicate Arch, Arches National Park",Master,130881,Scaled to fit your wall. Some cropping may occur.,"Photography, Horizontal, panoramic, panorama, Arches National Park, Arid Climate, Arid Landscape, Clear Sky, Color Image, Day, Delicate Arch, Desert, Natural Arch, Natural Landmark, Nature, No People, Non-Urban Scene, Outdoors, Physical Geography, Rock, Rock Formation, Sandstone, Scenic, Tranquil Scene, USA, Utah",https://s3-us-west-2.amazonaws.com/astek-product-images/National_Parks/130881_Delicate_Arch_Arches_National_Park_DELICATEARCHARCHESNATIONALPARK.jpg,,6.5,Square Foot,1,1,Photographic,"Orange, Multi",Paper,,,,,,,,,,Mural,,0.1,,Strippable,Washable,,Class A,Digital Print,Untrimmed,Yes
H,Panoramic Images,Digital,Murals,National Parks,Olympic National Park at Dusk,131051,Olympic National Park at Dusk,Master,131051,Scaled to fit your wall. Some cropping may occur.,"Photography, Horizontal, panoramic, panorama, Beauty In Nature, Cliff, Cloud, Color Image, Dusk, Evening, Idyllic, No People, Non-Urban Scene, Ocean, Olympic National Park, Outdoors, Physical Geography, Reflection, Scenic, Second Beach, Silhouette, Sky, Stack Rock, Sunlight, Sunset, Tranquil Scene, USA, Washington State",https://s3-us-west-2.amazonaws.com/astek-product-images/National_Parks/131051_Olympic_National_Park_at_Dusk_OLYMPICNATIONALPARKATDUSK.jpg,,6.5,Square Foot,1,1,Photographic,Multi,Paper,,,,,,,,,,Mural,,0.1,,Strippable,Washable,,Class A,Digital Print,Untrimmed,Yes
H,Panoramic Images,Digital,Murals,National Parks,Lake at Everglades National Park,142235,Lake at Everglades National Park,Master,142235,Scaled to fit your wall. Some cropping may occur.,"Photography, Horizontal, Beauty In Nature, Cloud, Color Image, Day, Everglades National Park, Florida, Lake, National Park, Nature, No People, Non-Urban Scene, Outdoors, Reflection, Scenics, Tranquil Scene, Travel Destinations, Tree, USA",https://s3-us-west-2.amazonaws.com/astek-product-images/National_Parks/142235_Lake_at_Everglades_National_Park_LAKEATEVERGLADESNATIONALPARK.jpg,,6.5,Square Foot,1,1,Photographic,"Blue, Multi",Paper,,,,,,,,,,Mural,,0.1,,Strippable,Washable,,Class A,Digital Print,Untrimmed,Yes
H,Panoramic Images,Digital,Murals,National Parks,"Lake Worth, Everglades National Park",147107,"Lake Worth, Everglades National Park",Master,147107,Scaled to fit your wall. Some cropping may occur.,"Photography, Horizontal, panoramic, panorama, Cloud, Color Image, Dusk, Evening, Everglades National Park, Florida, Grass, Idyllic, Lake, Lake Worth, Nature, No People, Outdoors, Palm Beach County, Reflection, Scenics, Sky, Sunset, Tranquil Scene, Travel Destinations, Tree, USA, Water Surface",https://s3-us-west-2.amazonaws.com/astek-product-images/National_Parks/147107_Lake_Worth_Everglades_National_Park_LAKEWORTHEVERGLADESNATIONALPARK.jpg,,6.5,Square Foot,1,1,Photographic,Multi,Paper,,,,,,,,,,Mural,,0.1,,Strippable,Washable,,Class A,Digital Print,Untrimmed,Yes
H,Panoramic Images,Digital,Murals,National Parks,"Anhinga Trail, Everglades National Park, Florida",148861,"Anhinga Trail, Everglades National Park, Florida",Master,148861,Scaled to fit your wall. Some cropping may occur.,"Photography, Horizontal, Anhinga Trail, Beauty In Nature, Cloud, Color Image, Day, Everglades National Park, Florida, Lake, Nature, No People, Non-Urban Scene, Outdoors, Reflection, Scenics, Sky, Tranquil Scene, Travel Destinations, Tree, USA",https://s3-us-west-2.amazonaws.com/astek-product-images/National_Parks/148861_Anhinga_Trail_Everglades_National_Park_Florida_ANHINGATRAILEVERGLADESNATIONALPARKFLORIDA.jpg,,6.5,Square Foot,1,1,Photographic,Multi,Paper,,,,,,,,,,Mural,,0.1,,Strippable,Washable,,Class A,Digital Print,Untrimmed,Yes
H,Panoramic Images,Digital,Murals,National Parks,"Bridal Veil Falls, Yosemite National Park",151975,"Bridal Veil Falls, Yosemite National Park",Master,151975,Scaled to fit your wall. Some cropping may occur.,"Photography, Horizontal, panoramic, panorama, Black and White, Beauty In Nature, Bridal Veil Falls Yosemite, California, Cliff, Cloud, Cold, Cold Temperature, Covering, Day, El Capitan, Frozen, Geology, Granite, Half Dome, Mountain, Mountain Peak, National Park, Nature, No People, Non-Urban Scene, Outdoors, Peacefulness, Physical Geography, Rock, Rock Formation, Scenics, Season, Sky, Snow, Tranquility, Travel Destinations, Tree, USA, Winter, Serenity, Californian Sierra Nevada, Tranquil Scene, Yosemite National Park, Calm, Covered, Peaceful, Tunnel View, Waterfall",https://s3-us-west-2.amazonaws.com/astek-product-images/National_Parks/151975_Bridal_Veil_Falls_Yosemite_National_Park_BRIDALVEILFALLSYOSEMITENATIONALPARK.jpg,,6.5,Square Foot,1,1,Photographic,"Black and White, Grey",Paper,,,,,,,,,,Mural,,0.1,,Strippable,Washable,,Class A,Digital Print,Untrimmed,Yes
H,Panoramic Images,Digital,Murals,National Parks,"Jordan Pond, Acadia National Park",152564,"Jordan Pond, Acadia National Park",Master,152564,Scaled to fit your wall. Some cropping may occur.,"Photography, Horizontal, panoramic, panorama, Acadia National Park, National Park, Beauty In Nature, Color Image, Day, Idyllic, Jordan Pond, Maine, Mountain, Nature, No People, Non-Urban Scene, Outdoors, Rock, Scenics, Sky, Tourism, Travel Destinations, USA, North Bubble",https://s3-us-west-2.amazonaws.com/astek-product-images/National_Parks/152564_Jordan_Pond_Acadia_National_Park_JORDANPONDACADIANATIONALPARK.jpg,,6.5,Square Foot,1,1,Photographic,"Green, Multi",Paper,,,,,,,,,,Mural,,0.1,,Strippable,Washable,,Class A,Digital Print,Untrimmed,Yes
H,Panoramic Images,Digital,Murals,National Parks,Forest Path in Redwood National Park,152728,Forest Path in Redwood National Park,Master,152728,Scaled to fit your wall. Some cropping may occur.,"Photography, Horizontal, panoramic, panorama, California, Color Image, Day, Forest, National Park, Nature, No People, Outdoors, Plant, Redwood National Park, Scenics, Tranquil Scene, Tree, Tree Trunk, USA, North America, Woods, Redwood Tree",https://s3-us-west-2.amazonaws.com/astek-product-images/National_Parks/152728_Forest_Path_in_Redwood_National_Park_FORESTPATHINREDWOODNATIONALPARK.jpg,,6.5,Square Foot,1,1,Photographic,"Green, Multi",Paper,,,,,,,,,,Mural,,0.1,,Strippable,Washable,,Class A,Digital Print,Untrimmed,Yes
H,Panoramic Images,Digital,Murals,National Parks,"Mather Point, Grand Canyon National Park",160803,"Mather Point, Grand Canyon National Park",Master,160803,Scaled to fit your wall. Some cropping may occur.,"Photography, Horizontal, panoramic, panorama, Mather Point, Mesa, Unusual, Point Of Interest, Nature, Beauty, Geology, Geological, Strata, Rocks, Rock Formations, Southwest, Color Photography, Grand Canyon, Az, Arizona, Usa, United States Of America, North America, America, Landscape, View, Western, West, American West, Romantic, Sweeping, Sublime, Awe Inspiring",https://s3-us-west-2.amazonaws.com/astek-product-images/National_Parks/160803_Mather_Point_Grand_Canyon_National_Park_MATHERPOINTGRANDCANYONNATIONALPARK.jpg,,6.5,Square Foot,1,1,Photographic,Multi,Paper,,,,,,,,,,Mural,,0.1,,Strippable,Washable,,Class A,Digital Print,Untrimmed,Yes
H,Panoramic Images,Digital,Murals,National Parks,"Aspen Trees, Grand Canyon National Park",174391,"Aspen Trees, Grand Canyon National Park",Master,174391,Scaled to fit your wall. Some cropping may occur.,"Photography, Horizontal, panoramic, panorama, Arizona, Aspen Tree, Beauty In Nature, Conifer Tree, Day, Forest, Grand Canyon National Park, Grove, Landscape, Mountain, Mountain Range, National Park, Nature, No People, Non-Urban Scene, Outdoors, Scenics, Teton Range, Tranquil Scene, Tranquility, Travel Destinations, Tree Trunk, USA, Yellow, Color Image, North America",https://s3-us-west-2.amazonaws.com/astek-product-images/National_Parks/174391_Aspen_Trees_Grand_Canyon_National_Park_ASPENTREESGRANDCANYONNATIONALPARK.jpg,,6.5,Square Foot,1,1,Photographic,Multi,Paper,,,,,,,,,,Mural,,0.1,,Strippable,Washable,,Class A,Digital Print,Untrimmed,Yes
H,Panoramic Images,Digital,Murals,National Parks,Denali National Park,1877,Denali National Park,Master,1877,Scaled to fit your wall. Some cropping may occur.,"Photography, Horizontal, panoramic, panorama, mountains, Denali National Park, Alaska, AK, USA, range, snow covered, nobody, isolated, mountain, reflection, forest, lake, shoreline, trees, wooded, hills, snow, scenic, water, wilderness, remote, tranquil, tranquility, seclusion, secluded, Denali Natl Park, Denali, day, daytime, afternoon, National Park, Natl Park, pastel, colorful, landscape, mountainous, mountainscape, majestic, majesty, height, pinnacle, peak, atop",https://s3-us-west-2.amazonaws.com/astek-product-images/National_Parks/1877_Denali_National_Park_DENALINATIONALPARK.jpg,,6.5,Square Foot,1,1,Photographic,Multi,Paper,,,,,,,,,,Mural,,0.1,,Strippable,Washable,,Class A,Digital Print,Untrimmed,Yes
H,Panoramic Images,Digital,Murals,National Parks,Glacier Bay National Park,203966,Glacier Bay National Park,Master,203966,Scaled to fit your wall. Some cropping may occur.,"Photography, Horizontal, panoramic, panorama, Alaska, Beauty In Nature, Cliff, Cold, Cold Temperature, Day, Frozen, Glacier, Glacier Bay, Glacier Bay National Park, Glacier Bay National Park and Preserve, Global Warming, Ice, Iceberg, Idyllic, Lake, Margerie Glacier, National Park, Nature, No People, Non-Urban Scene, Outdoors, Physical Geography, Scenics, Season, Snow, Southeast Alaska, Tourism, Tranquil Scene, Tranquility, Travel Destinations, USA, North America, Color Image, Sky, Cloud, Cloud - Sky",https://s3-us-west-2.amazonaws.com/astek-product-images/National_Parks/203966_Glacier_Bay_National_Park_GLACIERBAYNATIONALPARK.jpg,,6.5,Square Foot,1,1,Photographic,"Blue, Multi",Paper,,,,,,,,,,Mural,,0.1,,Strippable,Washable,,Class A,Digital Print,Untrimmed,Yes
H,Panoramic Images,Digital,Murals,National Parks,"College Fjord, Glacier Bay National Park",204011,"College Fjord, Glacier Bay National Park",Master,204011,Scaled to fit your wall. Some cropping may occur.,"Photography, Horizontal, panoramic, panorama, Color Image, Glacier Bay National Park and Preserve, Alaska, USA, North America, Ocean, Sky, Cloud, Cloud - Sky, Reflection, Glacier, Mountain, Mountain Range, Snow, Snowcapped, Snowcapped Mountain, Covering, Winter, Season, Beauty In Nature, Idyllic, Majestic, Outdoors, Day, No People, Nature, Scenics, Tranquil Scene, Tranquility, Non-Urban Scene, Travel Destinations, Cold, Global Warming, Ice, Cliff, Cold Temperature, Frozen, Glacier Bay, Glacier Bay National Park, Harvard Glacier, Yale Glacier, College Fjord",https://s3-us-west-2.amazonaws.com/astek-product-images/National_Parks/204011_College_Fjord_Glacier_Bay_National_Park_COLLEGEFJORDGLACIERBAYNATIONALPARK.jpg,,6.5,Square Foot,1,1,Photographic,Blue,Paper,,,,,,,,,,Mural,,0.1,,Strippable,Washable,,Class A,Digital Print,Untrimmed,Yes
H,Panoramic Images,Digital,Murals,National Parks,"North Fork Cascade Canyon, Grand Teton National Park",205014,"North Fork Cascade Canyon, Grand Teton National Park",Master,205014,Scaled to fit your wall. Some cropping may occur.,"Photography, Horizontal, panoramic, panorama, Beauty In Nature, Canyon, Cloud, Cloud - Sky, Color Image, Day, Field, Flower, Glacier Lily, Grand Teton National Park, Lake, Lake Solitude, Lakeshore, Lakeside, Lily, Mountain, Mountain Range, National Park, Nature, No People, Non-Urban Scene, North America, North Fork Cascade Canyon, Outdoors, Scenics, Sky, Teton Range, Rocky Mountains, Tranquil Scene, Tranquility, Travel Destinations, USA, Water, Wyoming",https://s3-us-west-2.amazonaws.com/astek-product-images/National_Parks/205014_North_Fork_Cascade_Canyon_Grand_Teton_National_Park_NORTHFORKCASCADECANYONGRANDTETONNATIONALPARK.jpg,,6.5,Square Foot,1,1,Photographic,Multi,Paper,,,,,,,,,,Mural,,0.1,,Strippable,Washable,,Class A,Digital Print,Untrimmed,Yes
H,Panoramic Images,Digital,Murals,National Parks,Zion National Park in Autumn,205360,Zion National Park in Autumn,Master,205360,Scaled to fit your wall. Some cropping may occur.,"Photography, Horizontal, Beauty In Nature, Flowing Water, Autumn, Calm, Cloud, Cloud - Sky, Color Image, Day, Fall, Fall Colors, Flowing, Idyllic, Majestic, Mountain, National Park, Nature, No People, Non-Urban Scene, North America, Outdoors, Peaceful, Peacefulness, Plant, River, Rock, Rock - Object, Scenics, Season, Sky, Stone, Tranquil Scene, Tranquility, Travel Destinations, Tree, USA, Utah, Zion National Park",https://s3-us-west-2.amazonaws.com/astek-product-images/National_Parks/205360_Zion_National_Park_in_Autumn_ZIONNATIONALPARKINAUTUMN.jpg,,6.5,Square Foot,1,1,Photographic,Multi,Paper,,,,,,,,,,Mural,,0.1,,Strippable,Washable,,Class A,Digital Print,Untrimmed,Yes
H,Panoramic Images,Digital,Murals,National Parks,"Yosemite Valley, Yosemite National Park",209118,"Yosemite Valley, Yosemite National Park",Master,209118,Scaled to fit your wall. Some cropping may occur.,"Photography, Horizontal, panoramic, panorama, Beauty In Nature, California, Cloud, Cloud - Sky, Color Image, Day, Half Dome, Idyllic, Majestic, Nature, No People, Non-Urban Scene, North America, Outdoors, Rock, Rock - Object, Rock Formation, Scenics, Sky, Tranquil Scene, Tranquility, Travel Destinations, USA, Yosemite National Park, National Park, Yosemite Valley",https://s3-us-west-2.amazonaws.com/astek-product-images/National_Parks/209118_Yosemite_Valley_Yosemite_National_Park_YOSEMITEVALLEYYOSEMITENATIONALPARK.jpg,,6.5,Square Foot,1,1,Photographic,"Grey, Blue",Paper,,,,,,,,,,Mural,,0.1,,Strippable,Washable,,Class A,Digital Print,Untrimmed,Yes
H,Panoramic Images,Digital,Murals,National Parks,"Ancient Groves Nature Trail, Olympic National Park",210545,"Ancient Groves Nature Trail, Olympic National Park",Master,210545,Scaled to fit your wall. Some cropping may occur.,"Photography, Horizontal, panoramic, panorama, Ancient Groves Nature Trail, Color Image, Day, Growth, Moss, National Park, Nature, No People, Non-Urban Scene, North America, Olympic National Park, Outdoors, Plant, Plant Life, Scenics, Sol Duc Area, Tranquil Scene, Tranquility, Travel Destinations, Tree Trunk, Washington State, USA, America, United States",https://s3-us-west-2.amazonaws.com/astek-product-images/National_Parks/210545_Ancient_Groves_Nature_Trail_Olympic_National_Park_ANCIENTGROVESNATURETRAILOLYMPICNATIONALPARK.jpg,,6.5,Square Foot,1,1,Photographic,"Black and White, Grey",Paper,,,,,,,,,,Mural,,0.1,,Strippable,Washable,,Class A,Digital Print,Untrimmed,Yes
