websites,vendor,product_category,product_type,collection,design_name,design_sku,variant_name,variant_type,sku,description,keywords,images,install_images,price,sale_unit,sale_quantity,minimum_quantity,style,color,substrate,backing,roll_width_inches,roll_length_yards,mural_width_inches,mural_height_inches,tile_width_inches,tile_height_inches,motif_width_inches,vertical_repeat_inches,repeat_match_type,printed_width_inches,weight,application,removability,washability,color_fastness,fire_rating,print_type,margin_trim,print_to_order
H,Panoramic Images,Digital,Murals,National Parks,"Swamp, Everglades National Park",23066,"Swamp, Everglades National Park",Master,23066,Scaled to fit your wall. Some cropping may occur.,"Photography, Horizontal, panoramic, panorama, Blue, Cloud, Color Image, Day, Everglades National Park, Florida, Green, Mangrove Tree, Nobody, Non-Urban Scene, North America, Outdoors, Reflection, Root, Sky, Swamp, Tall Grass, Tree, USA, Vast, Water, Wetland, White, Growth, Nature, Scenics, Tranquil Scene, Travel Destinations, UNESCO World Heritage Site",https://s3-us-west-2.amazonaws.com/astek-product-images/National_Parks/23066_Swamp_Everglades_National_Park_SWAMPEVERGLADESNATIONALPARK.jpg,,6.5,Square Foot,1,1,Photographic,"Blue, Green, Multi",Paper,,,,,,,,,,Mural,,0.1,,Strippable,Washable,,Class A,Digital Print,Untrimmed,Yes
H,Panoramic Images,Digital,Murals,National Parks,San Juan National Park,23390,San Juan National Park,Master,23390,Scaled to fit your wall. Some cropping may occur.,"Photography, Horizontal, panoramic, panorama, Aspen Tree, Autumn, Blue, Clear Sky, Color Image, Colorado, Day, Forest, Horizon Over Land, Mountain, Nobody, Non-Urban Scene, North America, Outdoors, Plant, San Juan Mountains, San Juan National Park, Shadow, Snow, Sunlight, Tree, Uncultivated, USA, White, Yellow, Scenics, Tranquil Scene, Travel Destinations, National Park",https://s3-us-west-2.amazonaws.com/astek-product-images/National_Parks/23390_San_Juan_National_Park_SANJUANNATIONALPARK.jpg,,6.5,Square Foot,1,1,Photographic,Multi,Paper,,,,,,,,,,Mural,,0.1,,Strippable,Washable,,Class A,Digital Print,Untrimmed,Yes
H,Panoramic Images,Digital,Murals,National Parks,Volcano National Park,23543,Volcano National Park,Master,23543,Scaled to fit your wall. Some cropping may occur.,"Photography, Horizontal, panoramic, panorama, Big Island, Color Image, Erupting, Famous Place, Fire, Flowing, Glowing, Hawaii, Hawaii Islands, Hawaii Volcanoes National Park, High Angle View, Hot, Kilauea, Lava, Melting, Molten, National Landmark, National Park, Nobody, North America, Ocean, Outdoors, Pacific Ocean, Rock, Rocky, Smoke, Steam, Surf, USA, Volcano, Volcano National Park, Water, Wave, Danger, Destruction, Energy, Environment, Heat, Natural Disaster, Natural Phenomenon, Nature, Physical Geography, Power, Coastal Feature, Coast, Rock Formation",https://s3-us-west-2.amazonaws.com/astek-product-images/National_Parks/23543_Volcano_National_Park_VOLCANONATIONALPARK.jpg,,6.5,Square Foot,1,1,Photographic,"Grey, Multi",Paper,,,,,,,,,,Mural,,0.1,,Strippable,Washable,,Class A,Digital Print,Untrimmed,Yes
H,Panoramic Images,Digital,Murals,National Parks,Zion National Park,24664,Zion National Park,Master,24664,Scaled to fit your wall. Some cropping may occur.,"Photography, Horizontal, panoramic, panorama, Arid Landscape, Bush, Cloud, Color Image, Day, National Park, Nobody, Non-Urban Scene, North America, Outdoors, Park, Remote, Rock, Rock Formation, Rocky, Rough, Sky, Tree, Uncultivated, USA, Utah, Zion National Park, Nature, Physical Geography, Travel Destinations",https://s3-us-west-2.amazonaws.com/astek-product-images/National_Parks/24664_Zion_National_Park_ZIONNATIONALPARK.jpg,,6.5,Square Foot,1,1,Photographic,Multi,Paper,,,,,,,,,,Mural,,0.1,,Strippable,Washable,,Class A,Digital Print,Untrimmed,Yes
H,Panoramic Images,Digital,Murals,National Parks,"Cathedral Group, Grand Teton National Park",24795,"Cathedral Group, Grand Teton National Park",Master,24795,Scaled to fit your wall. Some cropping may occur.,"Photography, Horizontal, panoramic, panorama, landscape, scenic, Grand Teton National Park, Wyoming, WY, USA, dramatic, storm, clouds, meadow, Cathedral Group, wildflowers, Balsam Root, flowers, colorful, blossoms, uninhabited, natural, nature, wilderness, afternoon, day, daytime, nobody, rugged, mountainous, mountains, Grand Tetons, Tetons, Grand Teton Natl Park, majestic, range, peaks, vast, jagged, isolated, remote, blooming, blossoming, spring, springtime, field, surreal, eerie, mysterious, weather, climate, atmosphere",https://s3-us-west-2.amazonaws.com/astek-product-images/National_Parks/24795_Cathedral_Group_Grand_Teton_National_Park_CATHEDRALGROUPGRANDTETONNATIONALPARK.jpg,,6.5,Square Foot,1,1,Photographic,"Green, Pink",Paper,,,,,,,,,,Mural,,0.1,,Strippable,Washable,,Class A,Digital Print,Untrimmed,Yes
H,Panoramic Images,Digital,Murals,National Parks,Yellowstone National Park,24902,Yellowstone National Park,Master,24902,Scaled to fit your wall. Some cropping may occur.,"Photography, Horizontal, panoramic, panorama, Aspen Tree, Fall Color, Autumn, Color Image, Day, Fall, In A Row, Lamar Valley, Landscape, Mountain, Mountain Range, National Park, Nobody, North America, Orange, Outdoors, Tree, Treelined, USA, Valley, Wyoming, Yellowstone National Park, Beauty In Nature, Change, Nature, Season, Tranquil Scene, Travel Destinations, Populus",https://s3-us-west-2.amazonaws.com/astek-product-images/National_Parks/24902_Yellowstone_National_Park_YELLOWSTONENATIONALPARK.jpg,,6.5,Square Foot,1,1,Photographic,"Orange, Multi",Paper,,,,,,,,,,Mural,,0.1,,Strippable,Washable,,Class A,Digital Print,Untrimmed,Yes
H,Panoramic Images,Digital,Murals,National Parks,Acadia National Park,25217,Acadia National Park,Master,25217,Scaled to fit your wall. Some cropping may occur.,"Photography, Horizontal, panoramic, panorama, Acadia National Park, Autumn, Birch Tree, Fall, Fall Color, Field, Forest, Grass, Green, Hancock County, Landscape, Maine, National forest, National Park, Nature, New England, Peacefulness, Scenics, Season, Travel Destinations, Tree Trunk, USA, Woods, Color Image, Day, Generic Location, No People, Outdoors, Tree, North America, Peaceful, Calm, Serenity, Tranquil Scene",https://s3-us-west-2.amazonaws.com/astek-product-images/National_Parks/25217_Acadia_National_Park_ACADIANATIONALPARK.jpg,,6.5,Square Foot,1,1,Photographic,Multi,Paper,,,,,,,,,,Mural,,0.1,,Strippable,Washable,,Class A,Digital Print,Untrimmed,Yes
H,Panoramic Images,Digital,Murals,National Parks,Redwoods Park,30609,Redwoods Park,Master,30609,Scaled to fit your wall. Some cropping may occur.,"Photography, Horizontal, panoramic, panorama, god rays, sun, beams, sunbeam, sunbeams, sun beams, sun beam, landscape, conifer, evergreen, Sequoia, forest, woods, woodland, tree, trees, upward, skyward, perspective, illuminate, illumination, UNESCO World Heritage Site, heavenly, mystical, spiritual, mist, misty, celestial, scenic, black and white, black & white, b&w, b & w, b/w, b / w, USA, CA, California, Park, National Park, Redwood Natl Park, Redwood National Park",https://s3-us-west-2.amazonaws.com/astek-product-images/National_Parks/30609_Redwoods_Park_REDWOODSPARK.jpg,,6.5,Square Foot,1,1,Photographic,"Black and White, Grey",Paper,,,,,,,,,,Mural,,0.1,,Strippable,Washable,,Class A,Digital Print,Untrimmed,Yes
H,Panoramic Images,Digital,Murals,National Parks,Pathway in Saguaro National Park,31993,Pathway in Saguaro National Park,Master,31993,Scaled to fit your wall. Some cropping may occur.,"Photography, Horizontal, panoramic, panorama, Saguaro Natl Park, Saguaro National Park, National Park, Park, West Tucson, W Tucson, AZ, USA, Saguaro, Pima County, mountains, cactus, cacti, Saguaro cacti, Saguaro cactus, vegetation, Prickly Pear cactus, desert, arid, dry, hot, day, daytime, blue sky, empty, nobody, deserted, uninhabited, desolate, road, dirt road, unpaved, path, pathway, trail, winding road, soil, curve, curving",https://s3-us-west-2.amazonaws.com/astek-product-images/National_Parks/31993_Pathway_in_Saguaro_National_Park_PATHWAYINSAGUARONATIONALPARK.jpg,,6.5,Square Foot,1,1,Photographic,Multi,Paper,,,,,,,,,,Mural,,0.1,,Strippable,Washable,,Class A,Digital Print,Untrimmed,Yes
H,Panoramic Images,Digital,Murals,National Parks,Grand Canyon National Park at Sunrise,32093,Grand Canyon National Park at Sunrise,Master,32093,Scaled to fit your wall. Some cropping may occur.,"Photography, Horizontal, panoramic, panorama, canyon, Toroweap Point, Grand Canyon Natl Park, Arizona, AZ, USA, red rocks, nobody, landscape, scenic, day, daytime, eroded, erosion, river, expansive, desolate, cliffs, cliff, overcast, cloudy, geology, rocks, perspective, overview, looking down, from above, ancient, enduring, Colorado River, World Heritage Site, vista, rim, National Park, National Monument, spectacular, wilderness, uninhabited, backcountry, plateau, afternoon, Natl Park, gorge, chasm, vast, deep",https://s3-us-west-2.amazonaws.com/astek-product-images/National_Parks/32093_Grand_Canyon_National_Park_at_Sunrise_GRANDCANYONNATIONALPARKATSUNRISE.jpg,,6.5,Square Foot,1,1,Photographic,Orange,Paper,,,,,,,,,,Mural,,0.1,,Strippable,Washable,,Class A,Digital Print,Untrimmed,Yes
H,Panoramic Images,Digital,Murals,National Parks,"Wonder Lake, Denali National Park",32387,"Wonder Lake, Denali National Park",Master,32387,Scaled to fit your wall. Some cropping may occur.,"Photography, Horizontal, panoramic, panorama, sunny, daytime, day, snow capped, mountainous, mountains, mountain, mountain range, evergreens, trees, mountainscape, forest, majestic, majesty, water, reflection, summer, peaceful, nobody, landscape, scenic, wilderness, Denali, Denali National Park, Denali Natl Park, National Park, Park, Mt McKinley, Mount McKinley, Wonder Lake, lake, Alaska, AK, USA, Alaska Range, height, altitude",https://s3-us-west-2.amazonaws.com/astek-product-images/National_Parks/32387_Wonder_Lake_Denali_National_Park_WONDERLAKEDENALINATIONALPARK.jpg,,6.5,Square Foot,1,1,Photographic,"Multi, Blue",Paper,,,,,,,,,,Mural,,0.1,,Strippable,Washable,,Class A,Digital Print,Untrimmed,Yes
H,Panoramic Images,Digital,Murals,National Parks,"Ohia Forest, Volcanos National Park",32624,"Ohia Forest, Volcanos National Park",Master,32624,Scaled to fit your wall. Some cropping may occur.,"Photography, Horizontal, panoramic, panorama, tree, fern, nature, natural, rainforest, rain forest, Volcanos Natl Park, Big Island, Hawaii, HI, USA, Volcanos National Park, Ohia Forest, ecology, environment, environmental, preserve, trees, forested, dense, thicket, canopied, canopy, canopies, remote, rural, misty, mist, fog, foggy, mood, moody",https://s3-us-west-2.amazonaws.com/astek-product-images/National_Parks/32624_Ohia_Forest_Volcanos_National_Park_OHIAFORESTVOLCANOSNATIONALPARK.jpg,,6.5,Square Foot,1,1,Photographic,Green,Paper,,,,,,,,,,Mural,,0.1,,Strippable,Washable,,Class A,Digital Print,Untrimmed,Yes
H,Panoramic Images,Digital,Murals,National Parks,Big Bend National Park,33401,Big Bend National Park,Master,33401,Scaled to fit your wall. Some cropping may occur.,"Photography, Horizontal, panoramic, panorama, Barren, Big Bend National Park, Clear Sky, Cliff, Color Image, Day, High Angle View, Landscape, Mountain, Mountain Range, National Landmark, National Park, Nobody, Non-Urban Scene, North America, Outdoors, Plant, Reflection, Remote, Rio Grande, River, Rocky, Shadow, Sunlight, Texas, USA, Water, Nature, Scenics, Tranquil Scene, Travel Destinations, Rock Formation",https://s3-us-west-2.amazonaws.com/astek-product-images/National_Parks/33401_Big_Bend_National_Park_BIGBENDNATIONALPARK.jpg,,6.5,Square Foot,1,1,Photographic,Multi,Paper,,,,,,,,,,Mural,,0.1,,Strippable,Washable,,Class A,Digital Print,Untrimmed,Yes
H,Panoramic Images,Digital,Murals,National Parks,Saguaro National Park,35129,Saguaro National Park,Master,35129,Scaled to fit your wall. Some cropping may occur.,"Photography, Horizontal, panoramic, panorama, Saguaro, National, Park, Tucson, AZ, USA, Arizona, bright, blue, sky, white, grey, puffy, clouds, cloud, sunny, daytime, warm, dry, arid, small, hills, hill, green, desert, vegetation, bushes, bush, shrubs, shrub, cacti, prickly, mountains, mountain, distance, scenic, landscape, desolate, quiet, peaceful",https://s3-us-west-2.amazonaws.com/astek-product-images/National_Parks/35129_Saguaro_National_Park_SAGUARONATIONALPARK.jpg,,6.5,Square Foot,1,1,Photographic,"Green, Multi",Paper,,,,,,,,,,Mural,,0.1,,Strippable,Washable,,Class A,Digital Print,Untrimmed,Yes
H,Panoramic Images,Digital,Murals,National Parks,Grand Canyon National Park,35265,Grand Canyon National Park,Master,35265,Scaled to fit your wall. Some cropping may occur.,"Photography, Horizontal, panoramic, panorama, sunrise, sunup, storm, storm cloud, yellow, geology, timelessness, rock, canyon, canyons, ancient, eroded, erosion, magnificant, golden, sunlight, storm clouds, dawn, morning, mesa, plateau, rock formation, river, Colorado River, USA, AZ, Arizona, Park, National Park, Grand Canyon Natl Park, Grand Canyon National Park, Grand Canyon, Hopi Point",https://s3-us-west-2.amazonaws.com/astek-product-images/National_Parks/35265_Grand_Canyon_National_Park_GRANDCANYONNATIONALPARK.jpg,,6.5,Square Foot,1,1,Photographic,Brown,Paper,,,,,,,,,,Mural,,0.1,,Strippable,Washable,,Class A,Digital Print,Untrimmed,Yes
H,Panoramic Images,Digital,Murals,National Parks,Redwood National Park,39055,Redwood National Park,Master,39055,Scaled to fit your wall. Some cropping may occur.,"Photography, Horizontal, panoramic, panorama, California, Color Image, Day, Foggy, Forest, Generic Location, Low Angle View, National Landmark, National Park, Nobody, North America, Outdoors, Redwood, Redwood National Park, Silhouette, Sunbeam, Sunlight, Tall, Tree, Uncultivated, USA, Pine Tree, Sun, Fog, UNESCO World Heritage Site",https://s3-us-west-2.amazonaws.com/astek-product-images/National_Parks/39055_Redwood_National_Park_REDWOODNATIONALPARK.jpg,,6.5,Square Foot,1,1,Photographic,Grey,Paper,,,,,,,,,,Mural,,0.1,,Strippable,Washable,,Class A,Digital Print,Untrimmed,Yes
H,Panoramic Images,Digital,Murals,National Parks,"Escalante Canyon, Zion National Park",43308,"Escalante Canyon, Zion National Park",Master,43308,Scaled to fit your wall. Some cropping may occur.,"Photography, Horizontal, panoramic, panorama, Arid Climate, Barren, Canyon, Cliff, Cloud, Color Image, Day, Eroded, Escalante Canyon, Extreme Terrain, Famous Place, Forest, Geology, Landscape, Mountain, National Landmark, National Park, Natural Landmark, Nature, No People, Non-Urban Scene, Outdoors, Physical Geography, Rock Formation, Sandstone, Scenics, Sky, Tranquil Scene, Travel Destinations, Tree, USA, Utah, Washington County, Zion National Park",https://s3-us-west-2.amazonaws.com/astek-product-images/National_Parks/43308_Escalante_Canyon_Zion_National_Park_ESCALANTECANYONZIONNATIONALPARK.jpg,,6.5,Square Foot,1,1,Photographic,Multi,Paper,,,,,,,,,,Mural,,0.1,,Strippable,Washable,,Class A,Digital Print,Untrimmed,Yes
H,Panoramic Images,Digital,Murals,National Parks,"Lower Falls, Yellowstone National Park",56695,"Lower Falls, Yellowstone National Park",Master,56695,Scaled to fit your wall. Some cropping may occur.,"Photography, Horizontal, panoramic, panorama, Cloud, Color Image, Day, Flowing, Forest, Grand Canyon, Green, Lower Falls, Natural Landmark, Nobody, North America, Outdoors, Ravine, River, Rock, Rocky, Rough, Rugged, Shadow, Sky, Tree, USA, Water, Waterfall, Wyoming, Yellowstone National Park, Beauty In Nature, Freshness, Nature, Physical Geography, Scenics, Tranquil Scene, Travel Destinations, Flowing Water, Sunlight",https://s3-us-west-2.amazonaws.com/astek-product-images/National_Parks/56695_Lower_Falls_Yellowstone_National_Park_LOWERFALLSYELLOWSTONENATIONALPARK.jpg,,6.5,Square Foot,1,1,Photographic,Multi,Paper,,,,,,,,,,Mural,,0.1,,Strippable,Washable,,Class A,Digital Print,Untrimmed,Yes
H,Panoramic Images,Digital,Murals,National Parks,"Redwood Sorrel, Redwood National Park",60442,"Redwood Sorrel, Redwood National Park",Master,60442,Scaled to fit your wall. Some cropping may occur.,"Photography, Horizontal, panoramic, panorama, Sorrel, Redwood, Natl, Park, Spring, CA, USA, California, bright, green, foliage, small, plants, plant, clover, close, up, wet, water, drops, drop, background, monochromatic",https://s3-us-west-2.amazonaws.com/astek-product-images/National_Parks/60442_Redwood_Sorrel_Redwood_National_Park_REDWOODSORRELREDWOODNATIONALPARK.jpg,,6.5,Square Foot,1,1,Photographic,Green,Paper,,,,,,,,,,Mural,,0.1,,Strippable,Washable,,Class A,Digital Print,Untrimmed,Yes
H,Panoramic Images,Digital,Murals,National Parks,Everglades National Park,62151,Everglades National Park,Master,62151,Scaled to fit your wall. Some cropping may occur.,"Photography, Horizontal, panoramic, panorama, Blue, Cloud, Color Image, Day, Endangered Species, Everglades National Park, Florida, Forest, Green, Landscape, National Park, Nobody, North America, Outdoors, Palmetto, Pine Tree, Sky, Tree, USA, Woods, Nature, Scenics, Tranquil Scene, Travel Destinations",https://s3-us-west-2.amazonaws.com/astek-product-images/National_Parks/62151_Everglades_National_Park_EVERGLADESNATIONALPARK.jpg,,6.5,Square Foot,1,1,Photographic,"Green, Blue",Paper,,,,,,,,,,Mural,,0.1,,Strippable,Washable,,Class A,Digital Print,Untrimmed,Yes
H,Panoramic Images,Digital,Murals,National Parks,Mist Over Acadia National Park,64405,Mist Over Acadia National Park,Master,64405,Scaled to fit your wall. Some cropping may occur.,"Photography, Horizontal, panoramic, panorama, mountains, Acadia National Park, ME, USA, Maine, haze, peaceful, light pinkish sky, quiet, sky, forest, trees, tree, woods, mist, cloud, clouds, moody, rolling, hills, landscape, scenic, isolated, wilderness, mountain, slopes, slope, peaks, peak, hazy, foggy, misty, eerie, vast, overview",https://s3-us-west-2.amazonaws.com/astek-product-images/National_Parks/64405_Mist_Over_Acadia_National_Park_MISTOVERACADIANATIONALPARK.jpg,,6.5,Square Foot,1,1,Photographic,"Blue, Multi",Paper,,,,,,,,,,Mural,,0.1,,Strippable,Washable,,Class A,Digital Print,Untrimmed,Yes
H,Panoramic Images,Digital,Murals,National Parks,Grand Teton National Park,67740,Grand Teton National Park,Master,67740,Scaled to fit your wall. Some cropping may occur.,"Photography, Horizontal, panoramic, panorama, Calm, Cloud, Covering, Generic Location, Grand Teton National Park, National Park, Jackson Hole, Landscape, Mountain, Mountain Range, Natural Landmark, Nature, Non-Urban Scene, Peacefulness, Physical Geography, Rough, Scenics, Sky, Snow, Snowcapped, Travel Destinations, Tree, USA, Valley, Wyoming, Color Image, Day, No People, Outdoors, Plant, Vast, Peaceful, Tranquil Scene",https://s3-us-west-2.amazonaws.com/astek-product-images/National_Parks/67740_Grand_Teton_National_Park_GRANDTETONNATIONALPARK.jpg,,6.5,Square Foot,1,1,Photographic,Multi,Paper,,,,,,,,,,Mural,,0.1,,Strippable,Washable,,Class A,Digital Print,Untrimmed,Yes
H,Panoramic Images,Digital,Murals,National Parks,Sequoia National Park,68365,Sequoia National Park,Master,68365,Scaled to fit your wall. Some cropping may occur.,"Photography, Horizontal, panoramic, panorama, sunset, dusk, twilight, fog, foggy, mist, misty, haze, nobody, uninhabited, trees, forest, slope, woods, woodland, pastel, Sequoia National Park, National Park, Natl Park, California, CA, USA, hills, foothills, landscape, scenic, mountain tops, mountains, countryside, rural",https://s3-us-west-2.amazonaws.com/astek-product-images/National_Parks/68365_Sequoia_National_Park_SEQUOIANATIONALPARK.jpg,,6.5,Square Foot,1,1,Photographic,Multi,Paper,,,,,,,,,,Mural,,0.1,,Strippable,Washable,,Class A,Digital Print,Untrimmed,Yes
H,Panoramic Images,Digital,Murals,National Parks,Acadia National Park,69024,Acadia National Park,Master,69024,Scaled to fit your wall. Some cropping may occur.,"Photography, Horizontal, panoramic, panorama, Acadia National Park, Autumn, Cliff, Cloud, Color Image, Day, Forest, Hancock County, Horizon Over Water, Maine, National Park, New England, Non-Urban Scene, Outdoors, Sea, Sky, Sunlight, Tree, USA, Water, Change, Fall, Fall Color, Generic Location, Nature, Rock, Rock Formation, Rough, Scenics, Seascape, Season, Tranquil Scene, Travel Destinations, Coast, Coastline, No People",https://s3-us-west-2.amazonaws.com/astek-product-images/National_Parks/69024_Acadia_National_Park_ACADIANATIONALPARK.jpg,,6.5,Square Foot,1,1,Photographic,Multi,Paper,,,,,,,,,,Mural,,0.1,,Strippable,Washable,,Class A,Digital Print,Untrimmed,Yes
H,Panoramic Images,Digital,Murals,National Parks,Canyonlands National Park,70723,Canyonlands National Park,Master,70723,Scaled to fit your wall. Some cropping may occur.,"Photography, Horizontal, panoramic, panorama, overview, Canyonlands Natl Park, Utah, UT, USA, day, nobody, landscape, perspective, from above, looking down, afternoon, scenic, canyon, rock formation, rough, rugged, daytime, desert, arid, National Park, mesa, mesas, basin, Canyonlands National Park, erosion, eroded, weathered, worn, vast, expansive, uninhabited, remote, isolated, barren, rocky, red rocks, buttes, butte, West, Canyonlands",https://s3-us-west-2.amazonaws.com/astek-product-images/National_Parks/70723_Canyonlands_National_Park_CANYONLANDSNATIONALPARK.jpg,,6.5,Square Foot,1,1,Photographic,Orange,Paper,,,,,,,,,,Mural,,0.1,,Strippable,Washable,,Class A,Digital Print,Untrimmed,Yes
H,Panoramic Images,Digital,Murals,National Parks,"Half Dome, Yosemite National Park",70729,"Half Dome, Yosemite National Park",Master,70729,Scaled to fit your wall. Some cropping may occur.,"Photography, Horizontal, panoramic, panorama, Yosemite Natl Park, Half Dome, Sierras, High Sierras, Natl Park, National Park, CA, USA, California, cloudy, mountainscape, mountainous, day, mountains, achievement, daytime, Yosemite National Park, pinnacle, scenic, overview, majesty, rugged, nobody, atop, rock formations, peak, success, majestic, uninhabitable, height, altitude, from above, wilderness, rocky, West, Yosemite, UNESCO World Heritage Site",https://s3-us-west-2.amazonaws.com/astek-product-images/National_Parks/70729_Half_Dome_Yosemite_National_Park_HALFDOMEYOSEMITENATIONALPARK.jpg,,6.5,Square Foot,1,1,Photographic,Multi,Paper,,,,,,,,,,Mural,,0.1,,Strippable,Washable,,Class A,Digital Print,Untrimmed,Yes
H,Panoramic Images,Digital,Murals,National Parks,"Half Dome, Yosemite National Park, B&W",70731,"Half Dome, Yosemite National Park, B&W",Master,70731,Scaled to fit your wall. Some cropping may occur.,"Photography, Horizontal, panoramic, panorama, trees, Half Dome, contrast, remote, Sierras, Yosemite National Park, wilderness, day, CA, USA, California, black and white, B&W, rugged, rock formation, clouds, landscape, scenic, mountain range, daytime, mountains, high angle view",https://s3-us-west-2.amazonaws.com/astek-product-images/National_Parks/70731_Half_Dome_Yosemite_National_Park_B_W_HALFDOMEYOSEMITENATIONALPARKBW.jpg,,6.5,Square Foot,1,1,Photographic,"Grey, Black and White",Paper,,,,,,,,,,Mural,,0.1,,Strippable,Washable,,Class A,Digital Print,Untrimmed,Yes
H,Panoramic Images,Digital,Murals,National Parks,"Beaver Pond, Grand Teton National Park",70736,"Beaver Pond, Grand Teton National Park",Master,70736,Scaled to fit your wall. Some cropping may occur.,"Photography, Horizontal, panoramic, panorama, Beaver Pond, pond, Grand Teton Natl Park, National Park, Natl Park, WY, USA, Wyoming, daytime, day, blue sky, forest, mountains, cloudless, trees, thicket, wilderness, nobody, woods, coniferous, overview, mirrored, reflection, nature, range, moutain range, snow capped, white, peaks, jagged, mountainscape, water, scenic, serene, calm, landscape, Grand Teton",https://s3-us-west-2.amazonaws.com/astek-product-images/National_Parks/70736_Beaver_Pond_Grand_Teton_National_Park_BEAVERPONDGRANDTETONNATIONALPARK.jpg,,6.5,Square Foot,1,1,Photographic,Multi,Paper,,,,,,,,,,Mural,,0.1,,Strippable,Washable,,Class A,Digital Print,Untrimmed,Yes
H,Panoramic Images,Digital,Murals,National Parks,Shenandoah National Park,71175,Shenandoah National Park,Master,71175,Scaled to fit your wall. Some cropping may occur.,"Photography, Horizontal, panoramic, panorama, Shenandoah National Park, dogwood trees, redbud trees, USA, Virginia, VA, day, daytime, nature, woods, forest, wooded, trees, budding, flowering, blossoms, blossom, outdoors, remote, foliage, tree, mossy, tree trunks, POV, no sky, secluded, wilderness, nobody, fragment, close up, spring",https://s3-us-west-2.amazonaws.com/astek-product-images/National_Parks/71175_Shenandoah_National_Park_SHENANDOAHNATIONALPARK.jpg,,6.5,Square Foot,1,1,Photographic,Multi,Paper,,,,,,,,,,Mural,,0.1,,Strippable,Washable,,Class A,Digital Print,Untrimmed,Yes
H,Panoramic Images,Digital,Murals,National Parks,Early Morning in Redwood National Park,76934,Early Morning in Redwood National Park,Master,76934,Scaled to fit your wall. Some cropping may occur.,"Photography, Horizontal, panoramic, panorama, sunrise, CA, California, USA, Redwoods, Redwood National Park, Redwood, Redwood Natl Park, Redwood Natl Pk, National Park, rays, light, trees, mysterious, ethereal, mystery, dawn, daybreak, day break, early morning, morning, ray, nobody, uninhabited, sun beam, sun beams, sunbeam, sunbeams, god rays, sunup, illuminate, illumination, forest, woods, woodland, grove, sylvan, celestial, heavenly",https://s3-us-west-2.amazonaws.com/astek-product-images/National_Parks/76934_Early_Morning_in_Redwood_National_Park_EARLYMORNINGINREDWOODNATIONALPARK.jpg,,6.5,Square Foot,1,1,Photographic,Grey,Paper,,,,,,,,,,Mural,,0.1,,Strippable,Washable,,Class A,Digital Print,Untrimmed,Yes
