websites,vendor,product_category,product_type,collection,design_name,design_sku,variant_name,variant_type,sku,description,keywords,images,install_images,price,sale_unit,sale_quantity,minimum_quantity,style,color,substrate,backing,roll_width_inches,roll_length_yards,mural_width_inches,mural_height_inches,tile_width_inches,tile_height_inches,motif_width_inches,vertical_repeat_inches,repeat_match_type,printed_width_inches,weight,application,removability,washability,color_fastness,fire_rating,print_type,margin_trim,print_to_order
H,Panoramic Images,Digital,Murals,National Parks,"Fern Forest, Volcanoes National Park",77027,"Fern Forest, Volcanoes National Park",Master,77027,Scaled to fit your wall. Some cropping may occur.,"Photography, Horizontal, panoramic, panorama, Close-Up, Color Image, Day, Dense, Fern Forest, Forest, Frond, Green, Hawaii, Hawaii Islands, Hawaii Volcanoes National Park, Leaf, Lush Foliage, National Park, Nobody, Non-Urban Scene, North America, Outdoors, Overgrown, Rainforest, Tree, Tree Trunk, Tropical, USA, Majestic, Scenics, Tranquil Scene, Travel Destinations, Plant",https://s3-us-west-2.amazonaws.com/astek-product-images/National_Parks/77027_Fern_Forest_Volcanoes_National_Park_FERNFORESTVOLCANOESNATIONALPARK.jpg,,6.5,Square Foot,1,1,Photographic,Green,Paper,,,,,,,,,,Mural,,0.1,,Strippable,Washable,,Class A,Digital Print,Untrimmed,Yes
H,Panoramic Images,Digital,Murals,National Parks,"Appalachian Mountains, Shenandoah National Park",79576,"Appalachian Mountains, Shenandoah National Park",Master,79576,Scaled to fit your wall. Some cropping may occur.,"Photography, Horizontal, panoramic, panorama, Appalachian Mountains, Autumn, Cloud, Color Image, Day, Forest, Generic Location, Landscape, Mountain, Mountain Range, National Park, Nobody, Non-Urban Scene, North America, Outdoors, Remote, Shenandoah National Park, Sky, Tree, USA, Valley, Virginia, Beauty In Nature, Nature, Scenics, Tranquil Scene, Travel Destinations, Fall, Physical Geography, Copy Space",https://s3-us-west-2.amazonaws.com/astek-product-images/National_Parks/79576_Appalachian_Mountains_Shenandoah_National_Park_APPALACHIANMOUNTAINSSHENANDOAHNATIONALPARK.jpg,,6.5,Square Foot,1,1,Photographic,Multi,Paper,,,,,,,,,,Mural,,0.1,,Strippable,Washable,,Class A,Digital Print,Untrimmed,Yes
H,Panoramic Images,Digital,Murals,National Parks,"Firehole River, Yellowstone National Park",81778,"Firehole River, Yellowstone National Park",Master,81778,Scaled to fit your wall. Some cropping may occur.,"Photography, Horizontal, panoramic, panorama, bison, herd, Yellowstone Natl Park, Wyoming, WY, USA, Firehole River, nobody, landscape, day, American Bison, buffalo, Yellowstone National Park, daytime, National Park, river, shoreline, riverbank, meadow, graze, grazing, feeding, wildlife, thermal area, field, geyser basin, wilderness, remote, isolated, Nature, bucolic, West, geyser, group, cold, winter, wintry, uninhabited, outdoors, clouds, cloudy, overcast, animals, mammals, UNESCO World Heritage Site",https://s3-us-west-2.amazonaws.com/astek-product-images/National_Parks/81778_Firehole_River_Yellowstone_National_Park_FIREHOLERIVERYELLOWSTONENATIONALPARK.jpg,,6.5,Square Foot,1,1,Photographic,Multi,Paper,,,,,,,,,,Mural,,0.1,,Strippable,Washable,,Class A,Digital Print,Untrimmed,Yes
H,Panoramic Images,Digital,Murals,National Parks,"Hawksnest Bay, Virgin Islands National Park",81900,"Hawksnest Bay, Virgin Islands National Park",Master,81900,Scaled to fit your wall. Some cropping may occur.,"Photography, Horizontal, panoramic, panorama, Hawksnest Bay, bay, Virgin Islands, US Virgin Islands, St. John, Saint John, USA, tropical, tropics, cloudy, sunny, ocean, shore, shoreline, coast, coastal, beach, sand, tides, day, day time, empty, nobody, pristine, calm, vacation, leisure, relax, relaxation, relaxing, tourist attraction, tourist destination, tourism, recreation, leisurely, quiet, peaceful, tranquil, tranquility, gentle, destination, journey, travel, National Park, USVI, Natl Park, tide",https://s3-us-west-2.amazonaws.com/astek-product-images/National_Parks/81900_Hawksnest_Bay_Virgin_Islands_National_Park_HAWKSNESTBAYVIRGINISLANDSNATIONALPARK.jpg,,6.5,Square Foot,1,1,Photographic,Blue,Paper,,,,,,,,,,Mural,,0.1,,Strippable,Washable,,Class A,Digital Print,Untrimmed,Yes
H,Panoramic Images,Digital,Murals,National Parks,"Lamar Valley, Yellowstone National Park",84319,"Lamar Valley, Yellowstone National Park",Master,84319,Scaled to fit your wall. Some cropping may occur.,"Photography, Horizontal, panoramic, panorama, Soda Butte Creek, Yellowstone Natl Park, Yellowstone National Park, National Park, USA, landscape, remote, uninhabited, wilderness, scenic, nature, natural, vista, overview, vast, empty, nobody, stream, Yellowstone, Lamar Valley, field, plain, meadow, grassland, mountainscape, creek, water, midday, mountains, mountainous, mountain range, range, valley, day, daytime, wide, environment, ecology, earth, natural resources, conservation, ecosystem, forest, wooded, woods, clouds, cloudy, seasonal, summer",https://s3-us-west-2.amazonaws.com/astek-product-images/National_Parks/84319_Lamar_Valley_Yellowstone_National_Park_LAMARVALLEYYELLOWSTONENATIONALPARK.jpg,,6.5,Square Foot,1,1,Photographic,Multi,Paper,,,,,,,,,,Mural,,0.1,,Strippable,Washable,,Class A,Digital Print,Untrimmed,Yes
H,Panoramic Images,Digital,Murals,National Parks,"Lupine Field, Redwood National Park",85470,"Lupine Field, Redwood National Park",Master,85470,Scaled to fit your wall. Some cropping may occur.,"Photography, Horizontal, panoramic, panorama, lupine field, field, flowers, Redwood Natl Park, CA, California, USA, day, daytime, blue sky, cloudless, nobody, detail, perspective, pink, purple, flowering, flower, bloom, blooming, blooms, season, seasonal, grow, growth, growing, summer, spring, colorful, color, tropical, Redwood National Park, from below, looking up, scenic, nature, natural, UNESCO World Heritage Site",https://s3-us-west-2.amazonaws.com/astek-product-images/National_Parks/85470_Lupine_Field_Redwood_National_Park_LUPINEFIELDREDWOODNATIONALPARK.jpg,,6.5,Square Foot,1,1,Photographic,"Purple, Blue",Paper,,,,,,,,,,Mural,,0.1,,Strippable,Washable,,Class A,Digital Print,Untrimmed,Yes
H,Panoramic Images,Digital,Murals,National Parks,"Prickly Pear Cactus, Joshua Tree National Park",88990,"Prickly Pear Cactus, Joshua Tree National Park",Master,88990,Scaled to fit your wall. Some cropping may occur.,"Photography, Horizontal, panoramic, panorama, Cactus, California, Clear Sky, Close-Up, Color Image, Day, Desert Plant, Green, Joshua Tree National Park, National Park, Nobody, Non-Urban Scene, Outdoors, Part Of, Plant, Prickly Pear Cactus, Thorn, Uncultivated, USA, Danger, Growth, Nature, Protection, Travel Destinations",https://s3-us-west-2.amazonaws.com/astek-product-images/National_Parks/88990_Prickly_Pear_Cactus_Joshua_Tree_National_Park_PRICKLYPEARCACTUSJOSHUATREENATIONALPARK.jpg,,6.5,Square Foot,1,1,Photographic,"Green, Multi",Paper,,,,,,,,,,Mural,,0.1,,Strippable,Washable,,Class A,Digital Print,Untrimmed,Yes
H,Panoramic Images,Digital,Murals,National Parks,"Acadia National Park, Maine",89571,"Acadia National Park, Maine",Master,89571,Scaled to fit your wall. Some cropping may occur.,"Photography, Horizontal, panoramic, panorama, Acadia National Park, Color Image, Day, Dense, Dusk, Forest, Generic Location, Maine, National Park, Nobody, Non-Urban Scene, North America, Outdoors, Part Of, Remote, Rock, Rock Formation, Shadow, Sunlight, Tree, Tree Trunk, USA, Wood, Nature, Scenics, Travel Destinations, Mount Desert Island, Picea",https://s3-us-west-2.amazonaws.com/astek-product-images/National_Parks/89571_Acadia_National_Park_Maine_ACADIANATIONALPARKMAINE.jpg,,6.5,Square Foot,1,1,Photographic,Brown,Paper,,,,,,,,,,Mural,,0.1,,Strippable,Washable,,Class A,Digital Print,Untrimmed,Yes
H,Panoramic Images,Digital,Murals,National Parks,"Monument Valley Tribal Park, Arizona",91063,"Monument Valley Tribal Park, Arizona",Master,91063,Scaled to fit your wall. Some cropping may occur.,"Photography, Horizontal, panoramic, panorama, Arid Landscape, Bush, Cloud, Color Image, Day, Desert, Famous Place, Geology, Landscape, Monument Valley, Monument Valley Tribal Park, National Landmark, National Park, Natural Landmark, Nobody, Non-Urban Scene, North America, Outdoors, Pinnacle, Plant, Rippled, Rock, Rock Formation, Sand, Sand Dune, Sky, Totem Pole Rock, USA, Yei Bi Chei, Arid Climate, Arizona, Nature, Physical Geography, Scenics, Tranquil Scene, Travel Destinations",https://s3-us-west-2.amazonaws.com/astek-product-images/National_Parks/91063_Monument_Valley_Tribal_Park_Arizona_MONUMENTVALLEYTRIBALPARKARIZONA.jpg,,6.5,Square Foot,1,1,Photographic,Multi,Paper,,,,,,,,,,Mural,,0.1,,Strippable,Washable,,Class A,Digital Print,Untrimmed,Yes
H,Panoramic Images,Digital,Murals,National Parks,"Redwood National Park, California",92200,"Redwood National Park, California",Master,92200,Scaled to fit your wall. Some cropping may occur.,"Photography, Horizontal, panoramic, panorama, California, Color Image, Column, Day, Dense, Forest, Generic Location, Green, Lush Foliage, National Park, Nobody, Non-Urban Scene, North America, Outdoors, Redwood, Redwood National Park, Tree, Tree Bark, Tree Trunk, Uncultivated, USA, Growth, Scenics, Tranquil Scene, Travel Destinations, Nature",https://s3-us-west-2.amazonaws.com/astek-product-images/National_Parks/92200_Redwood_National_Park_California_REDWOODNATIONALPARKCALIFORNIA.jpg,,6.5,Square Foot,1,1,Photographic,Green,Paper,,,,,,,,,,Mural,,0.1,,Strippable,Washable,,Class A,Digital Print,Untrimmed,Yes
H,Panoramic Images,Digital,Murals,National Parks,"Mount Desert Island, Acadia National Park",97967,"Mount Desert Island, Acadia National Park",Master,97967,Scaled to fit your wall. Some cropping may occur.,"Photography, Horizontal, panoramic, panorama, Acadia National Park, Cloud, Coast, Color Image, Day, Hancock County, Island, Maine, Monument Cove, Mount Desert Island, National Park, New England, Nobody, Non-Urban Scene, North America, Outdoors, Rock, Rock Formation, Sea, Sky, Surf, Tree, USA, Water, Wave, Beauty In Nature, Nature, Scenics, Tranquil Scene, Travel Destinations, Geology, Physical Geography, Coastline",https://s3-us-west-2.amazonaws.com/astek-product-images/National_Parks/97967_Mount_Desert_Island_Acadia_National_Park_MOUNTDESERTISLANDACADIANATIONALPARK.jpg,,6.5,Square Foot,1,1,Photographic,Multi,Paper,,,,,,,,,,Mural,,0.1,,Strippable,Washable,,Class A,Digital Print,Untrimmed,Yes
H,Panoramic Images,Digital,Murals,National Parks,"North Creek, Zion National Park",98596,"North Creek, Zion National Park",Master,98596,Scaled to fit your wall. Some cropping may occur.,"Photography, Horizontal, panoramic, panorama, Color Image, Day, Forest, National Landmark, National Park, Natural Landmark, Nobody, North America, North Creek, Outdoors, Tree, USA, Utah, Water, Waterfall, Zion National Park, Beauty In Nature, Nature, Scenics, Travel Destinations",https://s3-us-west-2.amazonaws.com/astek-product-images/National_Parks/98596_North_Creek_Zion_National_Park_NORTHCREEKZIONNATIONALPARK.jpg,,6.5,Square Foot,1,1,Photographic,Multi,Paper,,,,,,,,,,Mural,,0.1,,Strippable,Washable,,Class A,Digital Print,Untrimmed,Yes